{
  "schema": "tiger.registry/v1",
  "type": "developer",
  "slug": "code-utils",
  "module": "Tiger Utility Snippets",
  "vendor": "WebTigers",
  "repository": "https://github.com/WebTigers/TigerCodeSnippets",
  "website": "https://webtigers.com",
  "contact": "support@webtigers.com",
  "version": "1.0.1",
  "ref": "v1.0.1",
  "logo": "media/logo.jpg",
  "description": "A pack of small, dependency-free PHP helper snippets for the Code Area — slug(), human_bytes(), time_ago() and friends. Install it, read the source, and activate the ones you want.",
  "tiger_md": "https://raw.githubusercontent.com/WebTigers/TigerCodeSnippets/v1.0.1/TIGER.md",
  "keywords": [
    "code",
    "snippets",
    "helpers",
    "utilities",
    "php"
  ],
  "category": "snippets",
  "license": "BSD-3-Clause",
  "pricing": {
    "model": "free",
    "pro_url": null
  },
  "requires": {
    "tiger": ">=0.5",
    "php": ">=8.1"
  },
  "review": {
    "status": "accepted",
    "reviewed_ref": "v1.0.1",
    "reviewed_at": "2026-08-26",
    "reviewer": "tiger-vendor-bot",
    "notes": "Public repo; valid manifest + TIGER.md; BSD-3-Clause license; release v1.0.0 present; module layout conforms."
  }
}
