{
  "schema": "tiger.registry/v1",
  "type": "app",
  "slug": "tigerimage",
  "module": "TigerImage",
  "vendor": "WebTigers",
  "repository": "https://github.com/WebTigers/TigerImage",
  "website": "https://webtigers.com",
  "contact": "support@webtigers.com",
  "version": "1.3.2",
  "ref": "v1.3.2",
  "description": "Image generation for any agent. Drives the Tiger provider adapters you already use to turn a prompt into pictures, remembers how each one was made so it can be refined, and promotes the keepers into the Media Library. Gives a text-only assistant the ability to illustrate the page it just wrote — and enforces a hard spend ceiling, per organisation and per access key, before the provider is ever contacted.",
  "tiger_md": "https://raw.githubusercontent.com/WebTigers/TigerImage/v1.3.2/TIGER.md",
  "keywords": [
    "image",
    "image-generation",
    "diffusion",
    "ai",
    "openai",
    "gemini",
    "media",
    "agent",
    "mcp"
  ],
  "category": "ai",
  "license": "BSD-3-Clause",
  "pricing": {
    "model": "free",
    "pro_url": null
  },
  "requires": {
    "tiger": ">=1.5.22",
    "php": ">=8.1"
  },
  "review": {
    "status": "accepted",
    "reviewed_ref": "v1.3.2",
    "reviewed_at": "2026-09-27",
    "reviewer": "tiger-vendor-bot",
    "notes": "scripts/review.php passed: public repo; module.json 1.3.2 with a matching slug; TIGER.md at the pinned ref; BSD-3-Clause; CI-gated (PHPUnit 8.1-8.5 + JS + manifest). Bumped from the stale 1.0.4 pin (which shipped the dead routes.ini + ACL that caused TIGER-147)."
  }
}
