{
  "schema": "tiger.registry/v1",
  "type": "theme",
  "slug": "theme-grey-mist",
  "module": "Grey Mist",
  "vendor": "WebTigers",
  "repository": "https://github.com/WebTigers/theme-grey-mist",
  "website": "https://webtigers.com",
  "contact": "support@webtigers.com",
  "version": "1.0.0",
  "ref": "v1.0.0",
  "logo": "media/logo.jpg",
  "hero": "media/hero.jpg",
  "description": "A free, one-page Bootstrap 5 theme for Tiger — self-contained, zero external dependencies, fully editable CSS/JS.",
  "tiger_md": "https://raw.githubusercontent.com/WebTigers/theme-grey-mist/v1.0.0/TIGER.md",
  "keywords": [
    "theme",
    "bootstrap",
    "one-page",
    "landing",
    "grayscale",
    "mit",
    "responsive"
  ],
  "license": "MIT",
  "pricing": {
    "model": "free",
    "pro_url": null
  },
  "requires": {
    "tiger": ">=0.5",
    "php": ">=8.1"
  },
  "review": {
    "status": "accepted",
    "reviewed_ref": "v1.0.0",
    "reviewed_at": "2026-08-26",
    "reviewer": "tiger-vendor-bot",
    "notes": "Public repo; valid manifest + TIGER.md; MIT license; release v1.0.0 present; module layout conforms."
  }
}
